{
  "id": "unknown-license-fixture",
  "name": "Unknown License Fixture",
  "url": "https://github.com/example/unknown.git",
  "pinned_commit": "0123456789abcdef0123456789abcdef01234567",
  "license": "UNKNOWN",
  "license_files": [
    "LICENSE"
  ],
  "category": "reference-only",
  "role": "Test fixture with unknown license",
  "studied_paths": [
    "src"
  ],
  "studied_behavior": "Studied behavior.",
  "code_imported": false,
  "attribution_required": false,
  "caveats": [
    "Fixture with unknown license."
  ],
  "reviewer": "Test Reviewer",
  "verified_at": "2026-10-01T09:00:00+07:00"
}
